{"profile_id":"r5-regulatory-document","page":{"size":"A4","orientation":"portrait","margins_mm":[24,22,22,22]},"typography":{"body":"Noto Serif CJK SC","heading":"Noto Serif CJK SC","base_size_pt":10.5},"colors":{"primary":"#1F2937","secondary":"#F3F4F6","accent":"#1D4ED8","text":"#111827","muted":"#6B7280"},"cover":{"layout":"regulatory-letter","show_subject":true,"show_period":true},"tables":{"header_fill":"#1F2937","repeat_header":true,"dense":true},"charts":{"palette":["#1F2937","#1D4ED8","#64748B","#94A3B8"],"show_data_labels":true},"footer":{"page_number":true,"draft_mark":true}}
