{"profile_id":"r3-esg-editorial","page":{"size":"A4","orientation":"landscape","margins_mm":[18,20,18,20]},"typography":{"body":"Noto Sans CJK SC","heading":"Noto Sans CJK SC","base_size_pt":10.5},"colors":{"primary":"#355C54","secondary":"#DDE9E3","accent":"#88B8A8","text":"#252924","muted":"#65736D"},"cover":{"layout":"editorial-climate","show_subject":true,"show_period":true},"tables":{"header_fill":"#355C54","repeat_header":true,"dense":false},"charts":{"palette":["#355C54","#5F8C7C","#88B8A8","#B4CEC3"],"show_data_labels":true},"footer":{"page_number":true,"draft_mark":true}}
