{"profile_id":"r6-climate-pathway","page":{"size":"A4","orientation":"landscape","margins_mm":[18,18,16,18]},"typography":{"body":"Noto Sans CJK SC","heading":"Noto Sans CJK SC","base_size_pt":10.5},"colors":{"primary":"#007DB3","secondary":"#E7F5FA","accent":"#25A9E0","text":"#18313C","muted":"#627983"},"cover":{"layout":"climate-pathway","show_subject":true,"show_period":true},"tables":{"header_fill":"#007DB3","repeat_header":true,"dense":false},"charts":{"palette":["#007DB3","#25A9E0","#70C4E5","#6BBF59"],"show_data_labels":true},"footer":{"page_number":true,"draft_mark":true}}
