{"profile_id":"r4-form-audit","page":{"size":"A4","orientation":"portrait","margins_mm":[16,16,16,16]},"typography":{"body":"Noto Sans CJK SC","heading":"Noto Sans CJK SC","base_size_pt":9.5},"colors":{"primary":"#5D6268","secondary":"#E9EDF2","accent":"#BFD1EA","text":"#202428","muted":"#6E747A"},"cover":{"layout":"technical-form","show_subject":true,"show_period":true},"tables":{"header_fill":"#5D6268","repeat_header":true,"dense":true},"charts":{"palette":["#5D6268","#7AA6D8","#A9C98F","#D4B483"],"show_data_labels":true},"footer":{"page_number":true,"draft_mark":true}}
