{"profile_id":"r1-product-landscape","page":{"size":"A4","orientation":"landscape","margins_mm":[18,18,16,18]},"typography":{"body":"Noto Sans CJK SC","heading":"Noto Sans CJK SC","base_size_pt":10.5},"colors":{"primary":"#1F4F3A","secondary":"#EEF4F0","accent":"#79A84B","text":"#202522","muted":"#68716C"},"cover":{"layout":"product-hero","show_subject":true,"show_period":true},"tables":{"header_fill":"#1F4F3A","repeat_header":true,"dense":false},"charts":{"palette":["#F5822A","#8E24AA","#0D6EFD","#2E8B57","#4B5563"],"show_data_labels":true},"footer":{"page_number":true,"draft_mark":true}}
