{"profile_id":"r7-verification-opinion","page":{"size":"A4","orientation":"portrait","margins_mm":[24,22,22,22]},"typography":{"body":"Noto Sans CJK SC","heading":"Noto Sans CJK SC","base_size_pt":10.5},"colors":{"primary":"#263238","secondary":"#F4F6F7","accent":"#7C8B74","text":"#111516","muted":"#687376"},"cover":{"layout":"verification-opinion","show_subject":true,"show_period":true},"tables":{"header_fill":"#263238","repeat_header":true,"dense":true},"charts":{"palette":["#263238","#607D8B","#7C8B74","#A7B1A2"],"show_data_labels":true},"footer":{"page_number":true,"draft_mark":true}}
