{"profile_id":"r2-audit-portrait","page":{"size":"A4","orientation":"portrait","margins_mm":[22,20,20,20]},"typography":{"body":"Noto Sans CJK SC","heading":"Noto Sans CJK SC","base_size_pt":10.5},"colors":{"primary":"#244A74","secondary":"#EAF1F7","accent":"#2F6FED","text":"#1F2933","muted":"#66788A"},"cover":{"layout":"audit-ready","show_subject":true,"show_period":true},"tables":{"header_fill":"#244A74","repeat_header":true,"dense":true},"charts":{"palette":["#244A74","#2F6FED","#6EA8FE","#8FA6BC"],"show_data_labels":true},"footer":{"page_number":true,"draft_mark":true}}
